{
  "schema_version": "world_state_delta.v0.1",
  "delta_id": "delta_first_battle_result_001",
  "run_id": "run_demo_001",
  "worldbook_id": "long_night_lanterns",
  "source": "battle_result",
  "created_turn": 2,
  "summary": "灰灯驿站首战结束，守军稳住防线，工程师对玩家的信任略有回升。",
  "operations": [
    {
      "op": "set_progress_phase",
      "phase": "post_first_defense"
    },
    {
      "op": "set_map_node_state",
      "node_id": "gray_lantern_station",
      "patch": {
        "status": "secured",
        "threat_level": 0,
        "visibility": "visible",
        "available_actions": ["field_research", "rest", "talk_to_engineer"]
      }
    },
    {
      "op": "adjust_resource",
      "resource_id": "lamp_oil",
      "amount_delta": -3
    },
    {
      "op": "adjust_resource",
      "resource_id": "iron_scrap",
      "amount_delta": 2
    },
    {
      "op": "adjust_global_state",
      "field": "hope",
      "amount_delta": 0.08
    },
    {
      "op": "adjust_global_state",
      "field": "pressure",
      "amount_delta": -0.10
    },
    {
      "op": "update_npc_relationship",
      "npc_id": "engineer_001",
      "relationship_delta": { "trust": 0.08 }
    },
    {
      "op": "unlock_fact",
      "fact": {
        "fact_id": "engineer_lamp_calibration",
        "source": "first_battle",
        "visibility": "player_known",
        "summary": "工程师承认灯阵校准与玩家的现场判断一致。"
      }
    },
    {
      "op": "add_temporary_sample",
      "sample": {
        "sample_id": "sample_refraction_chard",
        "display_name": "焦黑的折射碎片",
        "source_delta_id": "delta_first_battle_result_001",
        "summary": "战后从灯座边缘拾得的碎片，表面有规则的灼烧纹路。"
      }
    },
    {
      "op": "append_event",
      "event": {
        "event_id": "first_battle_resolved",
        "turn": 2,
        "kind": "battle",
        "summary": "灰灯驿站首战告捷，夜雾暂退半步。"
      }
    },
    {
      "op": "set_flag",
      "flag": "tutorial_first_battle_completed",
      "value": true
    }
  ]
}
